,date,title,rating,userName,isEdited,review,developerResponse
144,10/3/22 22:47,Convenient and works pretty well,4,Most_Indubitably_Ted,FALSE,"Convenient and works pretty well.Have been a Divvy member since 2015. When I first started I didn’t even use the app — just wanted something to speed up the last mile to and from the train to work. If there were bikes in the dock when I looked, I’d unlock one with my physical keyfob and ride; if not, I wouldn’t! This app is quite an improvement since then, and I use Divvy much more, being able to plan around availability.  

I’m pleased that the odd map scrolling bug in the 14.39.42 update was fixed quickly. That made the app really hard to use.  

As for app problems, there are sometimes little glitches such as an e-bike showing on the map when it’s actually nowhere to be seen, or inaccurate counts of available bikes at a dock. But for the most part it works as it should.  

I haven’t noticed very many payment oddities, even since the Lyft buyout. A few times recently the app has had trouble authorizing with Apple Pay, but it clears up after a while, and I’m not sure which party is to blame. I’ve had overbilling happen just a couple of times over the years, but when I’ve called support, they’ve resolved it quickly.",
145,8/29/22 20:23,No clue,1,green swann,FALSE,No clue.First time user I scan the bar code and takes me to Lyft driver app. I use Divvy app and it says there is no internet connection. I ask people around and absolutely no one knows how to rent a bike.,
146,9/24/21 0:55,Could not get a bike,1,nejastquvshs,FALSE,"Could not get a bike.I spent half an hour trying to get the app to work, i would not receive any code. I even searched it up to make sure I’m doing things correctly and it didn’t make a difference. A waste of time",
147,8/17/21 16:24,Can’t get in,1,French street,FALSE,Can’t get in.I can only get to the second screen of the introduction. Really disappointed because I’m  also having problem the stand with getting the code to work.,
148,6/30/21 1:35,Watch your bank statement,1,yoyo yoski yolanda,FALSE,"Watch your bank statement.I purchased a full day $15 pass off my credit card. I was able to use the code provided to me only once. Every time I docked the bike, I was no longer able to use the code provided and was told to scan the QR code instead. This is where the issue came into play. Apparently, every time I scan with my phone, it was accruing a whole different payment method. So not only was I charged $15 off my credit card, I was also charged $15-16 additional dollars from the app. Needless to say with the $25 hold, my few hours of riding cost me well over $50.

I reached out to customer service. Entering into day 6, I heard nothing else from them regarding my refund, which is why I’m leaving this review. Know what your doing before renting these bikes. I’ll walk to where I’m going before ever considering renting from them again.",
149,7/15/19 2:11,Terrible,1,oceanjelly,FALSE,"Terrible.We got two 30 min passes, got to a station with 3 bikes and only one was able to be taken out, biked to a different station and code wouldn’t work. Would never use again and reading the other reviews I’m scared to check my bank account.",
150,6/18/19 23:54,12.15.0 is Broken,1,Standup_Sitdown,FALSE,"12.15.0 is Broken.Your app is NOT showing racks or bikes available as of 6/18. Crazy frustrating since it happened twice and I missed my evening Metra train not having a bike. (On iOS 12.3.1, iPhone 7 Plus). 

I’ve emailed support a bunch of screenshots. Please show QA and have engineers fix, this is super frustrating to users who use the app to unlock bikes with a paid, yearly plan that’s up to date. 

Warning to potential users - don’t buy a yearly membership until this is fixed.",
151,6/18/19 23:12,Favorited don’t work,1,e@.s,FALSE,"Favorited don’t work.I tried to filter on favorites and not only did it not work, but I couldn’t take the filter off. Made the app unusable. Also for divvy pass holders you can’t use the app to generate a ride code. Needs some work.",
152,6/18/19 17:05,Trash app,1,et470,FALSE,Trash app.Charged me twice while not sending the code,
153,8/19/18 12:08,GPS location,1,mlhdlkjn,FALSE,GPS location.Ever since the last update of the divvy app my current location is always off which doesn’t allow me to unlock a bike when I’m at a dock station but the app shows me not close enough to get a code to unlock a bike.,
154,9/28/18 15:22,"Divvy app works great for me, why so many negative reviews?",5,liquidcourage,FALSE,"Divvy app works great for me, why so many negative reviews?.Divvy is a bike sharing service to get you from point A to point B. The bikes are slow and heavy because they have to be durable enough to withstand all the idiots out there that abuse them. And speaking of idiots, giving the app one star because it doesn’t have one feature you like such as keeping track of your favorite docks? If you can’t figure out how to find a dock without that, you probably shouldn’t be riding a bike in the city. One star for not adequately tracking the calories you burn? Come on. Buy a Fitbit if you want to know that. The purpose of the app is to help you find an available bike nearby and access it using a code, and it works very well at doing that. It runs off the GPS on your phone, so if the location isn’t accurate, blame your cell service, not the Divvy app. The app is also not responsible for the traffic in Chicago that makes it difficult for you to get around on a bike.  It’s much easier to get around on a bike than a car in many cases, and much cheaper than Uber.",
155,5/29/18 2:15,Broken! Broken!!!,1,AbJain89,FALSE,"Broken! Broken!!!.Yes, I said it twice.

I registered on the app but the app says incorrect/ email not recognized.

I asked for a discount code and they sent a discount code which expired in December, 2017!

Some of the touch screens in town don’t work. Some of the bikes can’t be taken out of the lock.",